{
  "artifact_sha256": "bf2a62902cadb0dce646e39bbd5c93d1eb1986ddc4adc71854fca6c2f0936ef6",
  "calibration": {
    "adaptive_ece": {
      "adaptive_ece": 0.003023411006634104,
      "binning": "equal_mass",
      "bins": 10,
      "ci": [
        0.0016644612607788105,
        0.00741987624370686
      ],
      "resample_unit": "group"
    },
    "auroc_group_bootstrap": {
      "ci": [
        0.9915776433352061,
        0.9942275155043783
      ],
      "n_boot": 1000,
      "n_groups": 7744,
      "point": 0.9929086958137044,
      "resample_unit": "group"
    },
    "binary_calibrator": {
      "x_thresholds": [
        0.0,
        0.003922,
        0.007843,
        0.023529,
        0.039216,
        0.078431,
        0.082353,
        0.129412,
        0.141176,
        0.184314,
        0.188235,
        0.223529,
        0.227451,
        0.345098,
        0.34902,
        0.372549,
        0.443137,
        0.54902,
        0.584314,
        0.686275,
        0.690196,
        0.694118,
        0.698039,
        0.741176,
        0.745098,
        0.752941,
        0.823529,
        0.827451,
        0.890196,
        0.894118,
        0.917647,
        0.92549,
        0.945098,
        0.952941,
        0.968627,
        0.988235,
        0.996078,
        1.0
      ],
      "y_thresholds": [
        0.0,
        0.019231,
        0.033419,
        0.063291,
        0.067708,
        0.071429,
        0.089655,
        0.1,
        0.108333,
        0.109549,
        0.122222,
        0.122347,
        0.130045,
        0.142857,
        0.195652,
        0.216216,
        0.292994,
        0.315789,
        0.355828,
        0.362598,
        0.416667,
        0.444444,
        0.469136,
        0.471068,
        0.5,
        0.622222,
        0.628746,
        0.651852,
        0.770033,
        0.770115,
        0.787879,
        0.810811,
        0.860465,
        0.883117,
        0.941315,
        0.958084,
        0.981928,
        1.0
      ]
    },
    "conformal": {
      "abstention_rate": 0.0,
      "alpha": 0.1,
      "calibration_prevalence": 0.6651797968707109,
      "caveat": "Split-conformal coverage and calibration are guaranteed only under exchangeability with the calibration cohort; they are not guaranteed after distribution shift.",
      "coverage_by_class": {
        "0": 0.9003894240623078,
        "1": 0.9002372846383988
      },
      "empirical_coverage": 0.900288223991216,
      "empty_rate": 0.0833790831732089,
      "fit_on": "calibration",
      "mean_set_size": 0.9166209168267911,
      "method": "split_conformal_mondrian",
      "n_calibration": 14572,
      "n_test": 14572,
      "singleton_rate": 0.9166209168267911,
      "threshold_class_0": 0.3054313948808522,
      "threshold_class_1": 0.05424812801265677
    },
    "fpr_thresholds": {
      "0.001": 0.9841422139238876,
      "0.01": 0.946572483691778,
      "0.05": 0.4708170647945585
    },
    "method": "isotonic_regression_fit_on_calibration",
    "selective": [
      {
        "accuracy": 0.9617073840241559,
        "brier": 0.029214009164483298,
        "confidence_threshold": 0.0,
        "coverage_target": 1.0,
        "empirical_coverage": 1.0,
        "n_kept": 14572,
        "selective_risk": 0.03829261597584408,
        "threshold_fit_on": "calibration"
      },
      {
        "accuracy": 0.9877230440750343,
        "brier": 0.011523673071584159,
        "confidence_threshold": 0.8776792439484732,
        "coverage_target": 0.9,
        "empirical_coverage": 0.8999451001921493,
        "n_kept": 13114,
        "selective_risk": 0.012276955924965685,
        "threshold_fit_on": "calibration"
      },
      {
        "accuracy": 0.9955391610191301,
        "brier": 0.004366376231373799,
        "confidence_threshold": 0.9567387265245624,
        "coverage_target": 0.8,
        "empirical_coverage": 0.799958825144112,
        "n_kept": 11657,
        "selective_risk": 0.004460838980869864,
        "threshold_fit_on": "calibration"
      },
      {
        "accuracy": 0.9988235294117647,
        "brier": 0.0011753992091581677,
        "confidence_threshold": 0.987598601211952,
        "coverage_target": 0.7,
        "empirical_coverage": 0.6999725500960746,
        "n_kept": 10200,
        "selective_risk": 0.001176470588235294,
        "threshold_fit_on": "calibration"
      },
      {
        "accuracy": 0.9993137367036486,
        "brier": 0.000684294534512427,
        "confidence_threshold": 0.996544183741899,
        "coverage_target": 0.6,
        "empirical_coverage": 0.5999862750480374,
        "n_kept": 8743,
        "selective_risk": 0.0006862632963513668,
        "threshold_fit_on": "calibration"
      },
      {
        "accuracy": 0.9998627504803733,
        "brier": 0.00013722453283336846,
        "confidence_threshold": 0.9986076007775022,
        "coverage_target": 0.5,
        "empirical_coverage": 0.5,
        "n_kept": 7286,
        "selective_risk": 0.0001372495196266813,
        "threshold_fit_on": "calibration"
      }
    ],
    "tpr_at_fixed_thresholds_on_calibration": {
      "tpr_at_0.1fpr": 0.7870628288455587,
      "tpr_at_1fpr": 0.8981739399566697,
      "tpr_at_5fpr": 0.9670896523264211
    }
  },
  "calibration_partition": {
    "cohorts": {
      "defactify": 2535,
      "mage": 6000,
      "raid": 6037
    },
    "disjoint_from_pilot_development": true,
    "disjoint_from_pooled_train": true,
    "excluded_pilot_dev_groups": 4696,
    "n_rows": 14572,
    "source": "pooled calibration (mage valid + raid clean holdout + defactify)"
  },
  "config": {
    "batch_size": 16,
    "cal_rows": 6000,
    "grad_accum": 2,
    "inner_dev_frac": 0.12,
    "lr": 2e-05,
    "max_epochs": 3,
    "max_windows": 16,
    "train_rows": 15000
  },
  "created_utc": "2026-08-19T21:13:06Z",
  "data_firewall": "Each seed trains on a group-disjoint inner-train split of the pooled public-weight training pool (MAGE train + RAID clean + DeFactify train; all licenses permit derived weights) with inner-dev early stopping. The calibrator, split-conformal, low-FPR, and selective thresholds are fit on a pooled calibration partition (MAGE valid + RAID clean holdout + DeFactify) that is group-disjoint from the pooled training rows and from the pilot's development subsample. MAGE test/OOD/paraphrase, DeFactify/RAID holdouts, M4GT, EvoBench, and the reference corpus remain sealed for the one-shot Phase 6 evaluation.",
  "ensemble": {
    "aggregation": "mean of per-seed document probabilities",
    "calibration_metrics_calibrated": {
      "auroc": 0.9929086958137044,
      "brier": 0.029214009164483298,
      "n": 14572,
      "n_cohorts": 3,
      "per_cohort": {
        "defactify": {
          "auroc": 0.9999734643838961,
          "brier": 0.0012701580847473508,
          "n": 2535
        },
        "mage": {
          "auroc": 0.985374539898604,
          "brier": 0.04569506462254541,
          "n": 6000
        },
        "raid": {
          "auroc": 0.9941773933295006,
          "brier": 0.024567881905705424,
          "n": 6037
        }
      },
      "prevalence": 0.6651797968707109,
      "worst_cohort_auroc": 0.985374539898604,
      "worst_cohort_brier": 0.04569506462254541
    },
    "calibration_metrics_raw": {
      "auroc": 0.9929086958137044,
      "brier": 0.03327521035606248,
      "n": 14572,
      "n_cohorts": 3,
      "per_cohort": {
        "defactify": {
          "auroc": 0.9999734643838961,
          "brier": 0.0017505029481871045,
          "n": 2535
        },
        "mage": {
          "auroc": 0.985374539898604,
          "brier": 0.05579600623360933,
          "n": 6000
        },
        "raid": {
          "auroc": 0.9941773933295006,
          "brier": 0.02412999882942389,
          "n": 6037
        }
      },
      "prevalence": 0.6651797968707109,
      "worst_cohort_auroc": 0.985374539898604,
      "worst_cohort_brier": 0.05579600623360933
    }
  },
  "environment": {
    "cuda_device": "NVIDIA GeForce RTX 3090",
    "cuda_version": "12.6",
    "deterministic": "seeds set; cudnn.benchmark disabled; fp32 master weights + bf16 autocast",
    "git": {
      "commit": "fa1f7f2bc161af80720a0db40c1e8ea7c509b18b",
      "dirty": true
    },
    "numpy": "2.5.2",
    "platform": "Windows-11-10.0.26200-SP0",
    "python": "3.12.10",
    "torch": "2.13.0+cu126",
    "transformers": "5.15.0"
  },
  "limitations": [
    "Trained on the derived-weight-licensed pool (MAGE + RAID clean + DeFactify); EvoBench and M4GT remain evaluation-only under the license gate.",
    "The pool is binary (human vs fully machine); the majority-generation and contribution-fraction heads are external-evaluation-only until a terms-cleared mixed cohort is available.",
    "DeFactify contributes NYT news prose only; RAID/MAGE span broader registers, but calibration is population-conditional and transport to unseen cohorts is measured in Phase 6, not assumed.",
    "This card reports development and calibration metrics only; no final-test label was read."
  ],
  "phase": "Phase 5: frozen 3-seed neural detector, calibrated on held-out groups",
  "schema": "panoptes-neural-detector-v1",
  "seed_runs": [
    {
      "best_epoch": 3,
      "calibration_metrics_raw": {
        "auroc": 0.9919140697926022,
        "brier": 0.04461167907918232,
        "n": 14572,
        "n_cohorts": 3,
        "per_cohort": {
          "defactify": {
            "auroc": 0.9999761179455064,
            "brier": 0.0013974997102195606,
            "n": 2535
          },
          "mage": {
            "auroc": 0.9823694423223833,
            "brier": 0.07644463728742405,
            "n": 6000
          },
          "raid": {
            "auroc": 0.9937910432913922,
            "brier": 0.031119910891484834,
            "n": 6037
          }
        },
        "prevalence": 0.6651797968707109,
        "worst_cohort_auroc": 0.9823694423223833,
        "worst_cohort_brier": 0.07644463728742405
      },